{
  "schema_version": "0.0.1",
  "client_slug": "golden-mini-sdn-bhd",
  "legal_name": "Golden Mini Sdn. Bhd.",
  "entity_type": "Sdn Bhd",
  "fy_start": "2025-01-01",
  "fy_end": "2025-12-31",
  "framework": "MPERS",
  "jurisdiction_pack": "malaysia",
  "currency": "MYR",
  "industry_overlay": "services",
  "engagement_type": "year_end",
  "current_stage": "quality_review",
  "status": "in_progress",
  "stages_completed": [
    "setup",
    "source_documents",
    "record_transactions",
    "classify_transactions",
    "journal_entries",
    "bank_reconciliation",
    "subledger_reconciliations",
    "preliminary_trial_balance",
    "year_end_adjustments",
    "adjusted_trial_balance",
    "standards_review",
    "primary_statements",
    "notes"
  ],
  "artifacts": {
    "readme": "README.md",
    "source_register": "source/register.md",
    "transactions": "workpapers/transactions.json",
    "journals": "workpapers/journals.json",
    "journals_ye": "workpapers/journals_ye.json",
    "tb_preliminary": "workpapers/tb_preliminary.json",
    "tb_adjusted": "workpapers/tb_adjusted.json",
    "bank_recon": "workpapers/reconciliations/bank_maybank.md",
    "primary_statements": "outputs/fs/primary_statements.md",
    "notes": "outputs/fs/notes.md",
    "standards_review": "workpapers/standards_review.md"
  },
  "blockers": [],
  "open_queries": [],
  "provisional": false,
  "updated_at": "2026-07-08T18:42:05Z",
  "notes": "SYNTHETIC FIXTURE \u2014 not a real client. Used for agent/regression tests."
}
